[
 {
  "absent": [],
  "arrived_late": [],
  "meeting_date": "2024-12-10",
  "meeting_id": "city-council-2024-12-10",
  "present": [
   "off-kesarwani",
   "off-taplin",
   "off-bartlett",
   "off-tregub",
   "off-okeefe",
   "off-blackaby",
   "off-lunaparra",
   "off-humbert",
   "off-ishii"
  ],
  "record_archive_id": "bcc-2024-12-10-regular-annotated-agenda-record",
  "roll_call_time": "6:05 p.m."
 },
 {
  "absent": [
   "None Consent Calendar Public Comment on Consent Calendar",
   "Information Items Only: 1 speaker"
  ],
  "arrived_late": [],
  "meeting_date": "2024-12-10",
  "meeting_id": "city-council-2024-12-10-0",
  "present": [
   "off-kesarwani",
   "off-taplin",
   "off-bartlett",
   "off-tregub",
   "off-okeefe",
   "off-blackaby",
   "off-lunaparra",
   "off-humbert",
   "off-ishii"
  ],
  "record_archive_id": "bcc-2024-12-10-special-annotated-agenda-record",
  "roll_call_time": "5:39 p.m."
 },
 {
  "absent": [
   "off-bartlett"
  ],
  "arrived_late": [],
  "meeting_date": "2025-01-21",
  "meeting_id": "city-council-2025-01-21",
  "present": [
   "off-kesarwani",
   "off-taplin",
   "off-tregub",
   "off-okeefe",
   "off-blackaby",
   "off-lunaparra",
   "off-humbert",
   "off-ishii"
  ],
  "record_archive_id": "bcc-2025-01-21-regular-annotated-agenda-record",
  "roll_call_time": "6:16 p.m."
 },
 {
  "absent": [],
  "arrived_late": [],
  "meeting_date": "2025-02-11",
  "meeting_id": "city-council-2025-02-11-0",
  "present": [
   "off-kesarwani",
   "off-taplin",
   "off-bartlett",
   "off-tregub",
   "off-okeefe",
   "off-blackaby",
   "off-lunaparra",
   "off-humbert",
   "off-ishii"
  ],
  "record_archive_id": "bcc-2025-02-11-regular-annotated-agenda-record",
  "roll_call_time": "6:50 p.m."
 },
 {
  "absent": [
   "off-kesarwani",
   "off-bartlett"
  ],
  "arrived_late": [
   {
    "member": "off-bartlett",
    "time": "4:19 p.m."
   },
   {
    "member": "off-kesarwani",
    "time": "4:20 p.m."
   }
  ],
  "meeting_date": "2025-02-11",
  "meeting_id": "city-council-2025-02-11-1",
  "present": [
   "off-taplin",
   "off-tregub",
   "off-okeefe",
   "off-blackaby",
   "off-lunaparra",
   "off-humbert",
   "off-ishii"
  ],
  "record_archive_id": "bcc-2025-02-11-special-annotated-agenda-record",
  "roll_call_time": "4:08 p.m."
 },
 {
  "absent": [],
  "arrived_late": [],
  "meeting_date": "2025-02-25",
  "meeting_id": "city-council-2025-02-25",
  "present": [
   "off-kesarwani",
   "off-taplin",
   "off-bartlett",
   "off-tregub",
   "off-okeefe",
   "off-blackaby",
   "off-lunaparra",
   "off-humbert",
   "off-ishii"
  ],
  "record_archive_id": "bcc-2025-02-25-regular-annotated-agenda-v2-record",
  "roll_call_time": "6:02 p.m."
 },
 {
  "absent": [
   "Kesarwani Worksession 1. Berkeley Economic Dashboards Update From: City Manager Contact: Eleanor Hollander",
   "Economic Development",
   "(510) 981-7530"
  ],
  "arrived_late": [],
  "meeting_date": "2025-02-25",
  "meeting_id": "city-council-2025-02-25-0",
  "present": [
   "off-taplin",
   "off-bartlett",
   "off-tregub",
   "off-okeefe",
   "off-blackaby",
   "off-lunaparra",
   "off-humbert",
   "off-ishii"
  ],
  "record_archive_id": "bcc-2025-02-25-special-annotated-agenda-v2-record",
  "roll_call_time": "4:17 p.m."
 },
 {
  "absent": [
   "None Councilmember Humbert participated the meeting remotely under the just cause exception in the Brown Act"
  ],
  "arrived_late": [],
  "meeting_date": "2025-03-11",
  "meeting_id": "city-council-2025-03-11",
  "present": [
   "off-kesarwani",
   "off-taplin",
   "off-bartlett",
   "off-tregub",
   "off-okeefe",
   "off-blackaby",
   "off-lunaparra",
   "off-humbert",
   "off-ishii"
  ],
  "record_archive_id": "bcc-2025-03-11-regular-annotated-agenda-record",
  "roll_call_time": "6:38 p.m."
 },
 {
  "absent": [
   "off-bartlett"
  ],
  "arrived_late": [
   {
    "member": "off-bartlett",
    "time": "5:09 p.m."
   }
  ],
  "meeting_date": "2025-03-11",
  "meeting_id": "city-council-2025-03-11-0",
  "present": [
   "off-kesarwani",
   "off-taplin",
   "off-tregub",
   "off-okeefe",
   "off-blackaby",
   "off-lunaparra",
   "off-humbert",
   "off-ishii"
  ],
  "record_archive_id": "bcc-2025-03-11-special-annotated-agenda-record",
  "roll_call_time": "5:07 p.m."
 },
 {
  "absent": [
   "off-bartlett"
  ],
  "arrived_late": [
   {
    "member": "off-bartlett",
    "time": "6:30 p.m."
   }
  ],
  "meeting_date": "2025-03-18",
  "meeting_id": "city-council-2025-03-18",
  "present": [
   "off-kesarwani",
   "off-taplin",
   "off-tregub",
   "off-okeefe",
   "off-blackaby",
   "off-lunaparra",
   "off-humbert",
   "off-ishii"
  ],
  "record_archive_id": "bcc-2025-03-18-regular-annotated-agenda-record",
  "roll_call_time": "6:19 p.m."
 },
 {
  "absent": [
   "off-kesarwani",
   "off-bartlett"
  ],
  "arrived_late": [
   {
    "member": "off-kesarwani",
    "time": "4:20 p.m."
   },
   {
    "member": "off-bartlett",
    "time": "5:28 p.m."
   }
  ],
  "meeting_date": "2025-03-18",
  "meeting_id": "city-council-2025-03-18-0",
  "present": [
   "off-taplin",
   "off-tregub",
   "off-okeefe",
   "off-blackaby",
   "off-lunaparra",
   "off-humbert",
   "off-ishii"
  ],
  "record_archive_id": "bcc-2025-03-18-special-annotated-agenda-record",
  "roll_call_time": "4:07 p.m."
 },
 {
  "absent": [],
  "arrived_late": [],
  "meeting_date": "2025-03-25",
  "meeting_id": "city-council-2025-03-25",
  "present": [
   "off-kesarwani",
   "off-taplin",
   "off-bartlett",
   "off-tregub",
   "off-okeefe",
   "off-blackaby",
   "off-lunaparra",
   "off-humbert",
   "off-ishii"
  ],
  "record_archive_id": "bcc-2025-03-25-regular-annotated-agenda-record",
  "roll_call_time": "6:49 p.m."
 },
 {
  "absent": [
   "off-kesarwani",
   "off-bartlett"
  ],
  "arrived_late": [
   {
    "member": "off-bartlett",
    "time": "4:14 p.m."
   },
   {
    "member": "off-kesarwani",
    "time": "4:16 p.m."
   }
  ],
  "meeting_date": "2025-03-25",
  "meeting_id": "city-council-2025-03-25-0",
  "present": [
   "off-taplin",
   "off-tregub",
   "off-okeefe",
   "off-blackaby",
   "off-lunaparra",
   "off-humbert",
   "off-ishii"
  ],
  "record_archive_id": "bcc-2025-03-25-special-annotated-agenda-record",
  "roll_call_time": "4:09 p.m."
 },
 {
  "absent": [
   "off-bartlett"
  ],
  "arrived_late": [
   {
    "member": "off-bartlett",
    "time": "7:33 p.m."
   }
  ],
  "meeting_date": "2025-04-15",
  "meeting_id": "city-council-2025-04-15",
  "present": [
   "off-kesarwani",
   "off-taplin",
   "off-tregub",
   "off-okeefe",
   "off-blackaby",
   "off-lunaparra",
   "off-humbert",
   "off-ishii"
  ],
  "record_archive_id": "bcc-2025-04-15-regular-annotated-agenda-record",
  "roll_call_time": "7:05 p.m."
 },
 {
  "absent": [
   "off-kesarwani",
   "off-taplin",
   "off-bartlett",
   "off-tregub"
  ],
  "arrived_late": [
   {
    "member": "off-kesarwani",
    "time": "4:09 p.m."
   },
   {
    "member": "off-taplin",
    "time": "4:09 p.m."
   },
   {
    "member": "off-tregub",
    "time": "4:10 p.m."
   },
   {
    "member": "off-bartlett",
    "time": "4:10 p.m."
   }
  ],
  "meeting_date": "2025-04-15",
  "meeting_id": "city-council-2025-04-15-0",
  "present": [
   "off-okeefe",
   "off-blackaby",
   "off-lunaparra",
   "off-humbert",
   "off-ishii"
  ],
  "record_archive_id": "bcc-2025-04-15-special-annotated-agenda-record",
  "roll_call_time": "4:06 p.m."
 },
 {
  "absent": [
   "Bartlett Councilmember Taplin recused for potential conflict of interest at 6:14 p.m"
  ],
  "arrived_late": [
   {
    "member": "off-bartlett",
    "time": "6:17 p.m."
   }
  ],
  "meeting_date": "2025-04-22",
  "meeting_id": "city-council-2025-04-22",
  "present": [
   "off-kesarwani",
   "off-taplin",
   "off-tregub",
   "off-okeefe",
   "off-blackaby",
   "off-lunaparra",
   "off-humbert",
   "off-ishii"
  ],
  "record_archive_id": "bcc-2025-04-22-special-annotated-agenda-record",
  "roll_call_time": "6:04 p.m."
 },
 {
  "absent": [
   "off-kesarwani",
   "Bartlett Public Comment – 1 speaker Council Discussion 1.a. Introduction 1.b. Values",
   "Group Agreements 1.c. City Council Norms",
   "Procedures Break 1.d. Team Building Activity 1.e. Discussion of Council Priorities"
  ],
  "arrived_late": [],
  "meeting_date": "2025-04-25",
  "meeting_id": "city-council-2025-04-25",
  "present": [
   "off-taplin",
   "off-tregub",
   "off-okeefe",
   "off-blackaby",
   "off-lunaparra",
   "off-humbert",
   "off-ishii"
  ],
  "record_archive_id": "bcc-2025-04-25-special-annotated-agenda-record",
  "roll_call_time": "10:08 a.m."
 },
 {
  "absent": [
   "None Councilmember Taplin participated in the meeting remotely under the just cause exception in the Brown Act. Action Calendar Special City Council Meeting: Possible Ceasefire Resolution for Gaza Conflict",
   "the Impact",
   "Effects of the Conflict on the Berkeley Community",
   "Abroad 1. Resolution for an Immediate",
   "Permanent Ceasefire in Gaza",
   "an End to U.S. Military Aid to Israel",
   "Support for Palestinian Self-Determination From: Peace",
   "Justice Commission Recommendation: 1. The City of Berkeley Council adopt a resolution for a ceasefire in Gaza",
   "an end to U.S. military aid to Israel",
   "support for Palestinian self-determination. 2. Send a copy of the resolution to President Joseph R. Biden",
   "Secretary of State Antony Blinken",
   "Vice President Kamala Harris",
   "Representative Barbara Lee",
   "Senator Alex Padilla",
   "Senator Laphonza R. Butler",
   "Representative Cori Bush",
   "Representative Rashida Tlaib. Financial Implications: None Contact: Rex Brown",
   "Commission Secretary",
   "(510) 981-7000"
  ],
  "arrived_late": [],
  "meeting_date": "2025-04-28",
  "meeting_id": "city-council-2025-04-28",
  "present": [
   "off-kesarwani",
   "off-taplin",
   "off-bartlett",
   "off-tregub",
   "off-okeefe",
   "off-blackaby",
   "off-lunaparra",
   "off-humbert",
   "off-ishii"
  ],
  "record_archive_id": "bcc-2025-04-28-special-annotated-agenda-record",